author,permlink,title,category,body,json_metadata,created,root_title,url,children
lebu,the-search-for-the-right-one-episode-1-0b73d96210ce7,The search for the right one; Episode 1,fiction,"It was the second Thursday in January and Jonathan sat across from the man and woman who had come to interview him from big magazine. One of the very popular magazine in the world.

Jonathan was in the black sleeve fitted suits and pick lockdown with two girlfriends in front of one dress shirts and trouser. Do you want Nigerian born American actor was average height and dark in completion. As the normal protocol would go, while he was attending to the reporters, a beautiful young white lady served then drink.

• You were born in Nigeria I guess

Jonathan: I am proud to be a Nigerian.

• Do you visit Nigeria often

Jonathan: No, I haven’ I haven’t been there since I came to live in America but I hope to visit very soon. My parents and family members are there, I also have friends there as well but What I do is try as much as possible to participate in some Nigerian events here.

• At what age did you leave Nigeria?

Jonathan: when I was about 14 years

• You have captivated us with all your movies, could you ","{""tags"":[""fiction"",""nigeria"",""busy"",""esteem"",""life""],""app"":""esteem/1.5.1"",""format"":""markdown+html"",""community"":""esteem""}",2018-02-28 16:16:48,The search for the right one; Episode 1,/fiction/@lebu/the-search-for-the-right-one-episode-1-0b73d96210ce7,0
lebu,i-can-t-wait-to-see-her-an-open-letter-to-my-love-6b65a3db91378,I can't wait to see her. An open letter to my love.,open,"Today makes it a year I have sighted my love. I just hope she would understand my feeling for her. It  just a matter of a month, then I will be fully yours forever by then. You will be able to see me whenever you hope to see me then. 



  ![image](https://img.esteem.ws/mr26o1h3r0.jpg)



And i promise to take from that house you complain bitterly about. My love just be patient enough for me,  through this period of one month remaining. I am working towards all my promise made to you, and I think you will  be happy to  see the hopes and aspiration you want when am back.





 I could feel the love, romance and emotional trauma you are going through every day but all my promise to you will be fully fulfill and hopefully you will forget some night you had miss my warmeth  touch, kiss, and the affectionate. This is an open letter to my love.","{""links"":[],""image"":[""https://img.esteem.ws/mr26o1h3r0.jpg""],""tags"":[""open"",""letter"",""nigeria"",""wafrica"",""love""],""app"":""esteem/1.5.1"",""format"":""markdown+html"",""community"":""esteem""}",2018-04-24 14:57:12,I can't wait to see her. An open letter to my love.,/open/@lebu/i-can-t-wait-to-see-her-an-open-letter-to-my-love-6b65a3db91378,11
lebu,life-s-goes-on-f990e89468be8,Life's goes on,extraordinary,"People tends to forget how they find their way to that elevator point. But I want to quickly remind you when you are nobody and you have nothing to write about your history.


 ![image](https://img.esteem.ws/dwj1pob9qv.jpg)



 Just because you are chance doesn't mean you should behave to your benefactor anyhow. I can possibly tell you that the yoruba always say if you have your way through in life, there are some people who have contributed to the point you are today. 


But the life we live on now make it difficult for you to think about helping one out. So what do think of those who have the minds to render assistance to people. This is why they choose not to do it because after sharping the teeth of the people looking for assistance, they tend to bite the benefactor after being good to them.


 I just believed that life goes on, no matter what the situation we find ourselves.","{""links"":[],""image"":[""https://img.esteem.ws/dwj1pob9qv.jpg""],""tags"":[""extraordinary"",""benefactor"",""nigeria"",""wafrica"",""humanity""],""app"":""esteem/1.5.1"",""format"":""markdown+html"",""community"":""esteem""}",2018-04-20 13:40:06,Life's goes on,/extraordinary/@lebu/life-s-goes-on-f990e89468be8,1
lebu,get-it-done-in-the-right-way-610c397335baa,Get it done in the right way.,accomplishment,"I quite understand to make it in life is quite difficult, but there is this side force of achievement which pushed human being backward and forward of their glory. It only takes people who are dedicated and committed to attain success in life are the one who move or advanced forward to the elevated point. 


 ![image](https://img.esteem.ws/ctgasl6tze.jpg)


So to make it in life you have extra work to do with your acceleration and way you can comprehend with the situation around you. If you're the type that is slow learner, you don't have much time to waste like other who can grab fast when it comes to digestion of information.




 But because you are slow does not mean that you cannot achieve also. Indeed  my advice to you is to get what you're doing right from the onset for yourself. At the end you have something to act on doing and you will be proud to tell the story that you are on the right side.","{""links"":[],""image"":[""https://img.esteem.ws/ctgasl6tze.jpg""],""tags"":[""accomplishment"",""acceleration"",""nigeria"",""right"",""time""],""app"":""esteem/1.5.1"",""format"":""markdown+html"",""community"":""esteem""}",2018-04-17 20:29:00,Get it done in the right way.,/accomplishment/@lebu/get-it-done-in-the-right-way-610c397335baa,0
lebu,the-search-for-the-right-one-episode-21-a64599b720e6d,The Search for the right one; Episode 21,story,"Ono was cooking in kitchen while her children were in the living room watching Tom and Jerry cartoon on the flat screen TV. Amos, the second child had a big toy car in his hands. The sofa and armchair were made of beige leather. The dining area was in a corner. six chair surrounded the table with an oak finished top.



The three children looked up at Jite. Eight year old Jonah who looked a lot like his father was in class four in one of the private Elementary schools In the neighborhood. He was intellectually quick, outspoken, and assertive. As a baby, he was very cute and everyone wanted to carry him. As he grew, he became very active and would scream if he didn't get what he wanted or wanted a particular person to him.","{""tags"":[""story"",""life"",""fiction"",""nigeria"",""africa""],""app"":""esteem/1.5.1"",""format"":""markdown+html"",""community"":""esteem""}",2018-04-09 13:18:57,The Search for the right one; Episode 21,/story/@lebu/the-search-for-the-right-one-episode-21-a64599b720e6d,1
lebu,the-search-for-the-right-one-episode-20-c75a9ee8d938f,The Search for the right one; Episode 20,story,"After her graduation and the completion of the one year mandatory service by nigeria graduates five years ago, Jite decided to move to Abuja, to live with Ono's family. She wanted to get a job and also assist Ono in taking care of her three children: Jonah, Amos, and the youngest and only female, Mary.



Jite climbed the stairs and soon reached the first floor. She turned right toward the door of the three bedroom apartment at the back. Bringing out a bunch of keys, she selected one and unlocked the door. As she stepped inside the living room, she was greeted by the aroma of boiled chicken and voice from TV.","{""tags"":[""story"",""life"",""fiction"",""nigeria"",""africa""],""app"":""esteem/1.5.1"",""format"":""markdown+html"",""community"":""esteem""}",2018-04-07 15:54:24,The Search for the right one; Episode 20,/story/@lebu/the-search-for-the-right-one-episode-20-c75a9ee8d938f,0
