author,permlink,title,category,body,json_metadata,created,root_title,url,children
thomisin,when-triggers-lead-to-unforeseen,When Triggers Lead to Unforeseen Health Outcomes,hive-196387,"<div class=""text-justify"">

Our body system is very complicated and certain irritations can cause significant changes that can be worrisome to our health. While seeing a movie this morning, I saw a movie where a young lady cut her wrist and was bleeding profusely and a friend tried to save her but was unable to. When the mortality test results arived, she was said to have died of hemophilia and not the cut. So it was said that why a cut was a factor, it was not the reason for her death. With this, I decided to check if it was possible for something to be a trigger but not the cause of death, and I found a case study.

The notion that a trigger could be distinct from the ultimate cause of death prompted me to explore an intriguing case study. The story of 11-year-old Cameron Jean-Pierre unfolded, recounting a seemingly innocuous event. During a visit to his grandmother's home, the aroma of frying fish wafted through the air. Upon inhaling the scent, Cameron collapsed. His father rushed to his aid with an inha","{""image"":[""https://upload.wikimedia.org/wikipedia/commons/6/6b/Allergic_exanthema_amoxicillin.jpg"",""https://commons.wikimedia.org/wiki/File:Allergic_exanthema_amoxicillin.jpg"",""https://cdn2.picryl.com/photo/2016/01/14/us-air-force-staff-sgt-cherie-gregory-an-allergy-4733f3-1024.jpg""],""tags"":[""hive-196387"",""stemng"",""stemgeeks"",""ocdb"",""neoxian"",""health"",""waivio"",""cent"",""bee"",""alive""],""description"":"""",""app"":""ecency/3.0.35-vision"",""format"":""markdown+html"",""image_ratios"":[""0.9523"",0,""1.4993""]}",2023-08-16 00:17:48,When Triggers Lead to Unforeseen Health Outcomes,/hive-196387/@thomisin/when-triggers-lead-to-unforeseen,2
thomisin,the-complex-web-of-sleep,"The Complex Web of Sleep Deprivation: Causes, Effects, and Solutions",hive-196387,"<div class=""text-justify"">

Sleep deprivation is a prevalent concern that touches the lives of many, with its repercussions spanning from the individual to societal levels. The importance of sleep is widely recognized, as it rejuvenates our bodies and minds, fortifies our mental well-being, and significantly contributes to our overall health. Yet, the grasp of sleep deprivation can be relentless, stemming from a multitude of factors that disrupt our restful nights.

At its core, sleep deprivation often arises from a myriad of origins. It can be a consequence of medical conditions such as insomnia, depression, or other disorders that intricately affect our ability to fall and stay asleep. However, it is crucial to recognize that external influences play an equally significant role. The relentless demands of modern life, work-related stressors, looming deadlines, and a perpetually connected world all conspire to rob us of the rest we so desperately need.

https://images.pexels.com/photos/3771069/pexels-photo-3","{""image"":[""https://images.pexels.com/photos/3771069/pexels-photo-3771069.jpeg"",""https://live.staticflickr.com/144/391999554_4b7abce822_b.jpg""],""tags"":[""hive-196387"",""stemng"",""stemgeeks"",""neoxian"",""ocdb"",""sleep"",""waivio"",""cent"",""proofofbrain"",""alive""],""description"":"""",""app"":""ecency/3.0.35-vision"",""format"":""markdown+html"",""image_ratios"":[""1.5006"",""1.3333""]}",2023-08-12 21:36:00,"The Complex Web of Sleep Deprivation: Causes, Effects, and Solutions",/hive-196387/@thomisin/the-complex-web-of-sleep,3
thomisin,deciphering-the-intricate-survival-strategies,Deciphering the Intricate Survival Strategies of Vibrio Cholera,hive-196387,"<div class=""text-justify"">

The term ""pandemic"" is likely a concept you're well-acquainted with. The COVID-19 pandemic serves as a recent and vivid illustration of this phenomenon. When a disease is deemed pandemic, it signifies its widespread occurrence, encompassing regions as vast as continents or even spanning the entire globe. The ebb and flow of pandemics typically follow a pattern, beginning with an initial surge in cases due to person-to-person transmission, often lacking an immediate cure. Subsequently, these outbreaks tend to taper off, and in some cases, the disease may even recede over time. While this general trend holds true for many pandemics, the story of cholera offers a notable exception.


![675px-Suspected_Source_of_Cholera-_Waste_Water_-_Nigeria_(16436898133).jpg](https://images.hive.blog/DQmXDPAt5UA4p4BJPyESxT7UjiJyVfX8ZcDazdtJLNLXrjk/675px-Suspected_Source_of_Cholera-_Waste_Water_-_Nigeria_(16436898133).jpg)</div>
<sub><a href=""https://commons.wikimedia.org/wiki/File:Suspected_Source_o","{""image"":[""https://commons.wikimedia.org/wiki/File:Suspected_Source_of_Cholera-_Waste_Water_-_Nigeria_%2816436898133%29.jpg"",""https://commons.wikimedia.org/wiki/File:Patients_lie_in_bed_at_a_cholera_treatmen_centre_in_the_Budiriro_District,_that_was_badly_affected_by_cholera,_in_Harare,_Zimbabwe_on_the_21st_April,_2009._Photo-_Kate_Holt_-_AusAID_%2810712704546%29.jpg"",""https://cdn2.picryl.com/photo/2021/02/26/adult-cholera-patient-854bdb-640.jpg""],""tags"":[""hive-196387"",""stem"",""neoxian"",""ocdb"",""disease"",""proofofbrain"",""stemgeeks"",""waivio"",""cent"",""bee""],""description"":"""",""app"":""ecency/3.0.35-vision"",""format"":""markdown+html"",""image_ratios"":[0,0,""1.5130""]}",2023-08-05 14:29:51,Deciphering the Intricate Survival Strategies of Vibrio Cholera,/hive-196387/@thomisin/deciphering-the-intricate-survival-strategies,3
thomisin,navigating-the-path-to-millionaire-status-as-a-teenager,Navigating the Path to Millionaire Status as a Teenager,hive-167922,"<div class=""text-justify"">

In the dynamic landscape of 2023, achieving millionaire status isn't a daunting endeavor; it's remarkably straightforward, though not necessarily effortless. Let's emphasize simplicity over ease, as the modern era offers an array of opportunities accessible through a smartphone and an internet connection.

The internet is brimming with potential wealth waiting to be harnessed. It's crucial to shift your focus from pointing fingers or waiting for government interventions to taking proactive steps toward financial success. Recognize that while the government plays a role, your aspirations demand your own endeavors. Abundant wealth is within reach for those willing to seize it, so instead of resenting the affluent, seek to learn from them. Surround yourself with individuals who have mastered financial success; their perspectives and strategies can reshape your thinking.

https://miro.medium.com/v2/resize:fit:1358/1*Mj3JhxGwPy-KdHr58BznZw.jpeg</div>
<sub><a href=""https://medium.com/@a","{""app"":""leothreads/0.3"",""format"":""markdown"",""tags"":[""hive-167922"",""ocdb"",""neoxian"",""finance"",""investing"",""waivio"",""cent"",""bee"",""proofofbrain"",""leofinance""],""canonical_url"":""https://leofinance.io/@thomisin/navigating-the-path-to-millionaire-status-as-a-teenager"",""links"":[""https://miro.medium.com/v2/resize:fit:1358/1*Mj3JhxGwPy-KdHr58BznZw.jpeg</div>"",""https://medium.com/@anishsadhu5/improving-communication-skills-f3d41812554d\"">medium</a></sub></center></div>"",""https://www.curtin.edu.au/news/wp-content/uploads/2022/11/economic-growth-lac-800x432-1.jpg</div>"",""https://research.curtin.edu.au/news/untapped-local-labour-resources-crucial-to-easing-skills-and-jobs-shortages/?type=media\"">research.curtin.edu.au</a></sub></center></div>"",""https://leofinance.io/@thomisin/navigating-the-path-to-millionaire-status-as-a-teenager)""],""images"":[]}",2023-08-05 00:29:06,Navigating the Path to Millionaire Status as a Teenager,/hive-167922/@thomisin/navigating-the-path-to-millionaire-status-as-a-teenager,1
thomisin,a-journey-to-building-wealth-and-security-from-scarcity,A Journey to Building Wealth and Security from Scarcity,hive-167922,"In our world, we often hear that we shouldn't compare ourselves to others, but the reality remains that competition is everywhere. It seems as though we are in a constant race, vying for success and striving to make our mark. While it's true that we shouldn't let comparison consume us, it's essential to acknowledge that hard work and effort are rewarded in life.

One widely recognized truth is that financial independence is a key aspect of a fulfilled life. The ability to make money while you sleep is a goal many aspire to achieve. While not all of us can reach the coveted top 1% of the world's wealth, we can still strive to be among the top 10% or carve our own path towards financial stability and fulfillment.

For some, financial education might seem like an unfamiliar terrain, but with the right mindset and determination, going from zero to your first $20k is attainable. This achievement often involves investing and creating passive income streams, which require sweat, hard work, and time. However, it's c","{""app"":""leothreads/0.3"",""format"":""markdown"",""tags"":[""hive-167922"",""finance"",""wealth"",""leo"",""waivio"",""cent"",""ocdb"",""alive"",""bee"",""leofinance""],""canonical_url"":""https://leofinance.io/@thomisin/a-journey-to-building-wealth-and-security-from-scarcity"",""links"":[""https://www.maxpixel.net/static/photo/1x/Ladder-Reach-Earn-Success-Money-Way-Successful-3236223.jpg</div>"",""https://www.maxpixel.net/Ladder-Reach-Earn-Success-Money-Way-Successful-3236223\"">Max"",""https://leofinance.io/@thomisin/a-journey-to-building-wealth-and-security-from-scarcity)""],""images"":[]}",2023-07-31 00:06:00,A Journey to Building Wealth and Security from Scarcity,/hive-167922/@thomisin/a-journey-to-building-wealth-and-security-from-scarcity,1
thomisin,nothing-good-lasts-forever-exploring,Nothing Good Lasts Forever: Exploring the Science of Food Spoilage,hive-196387,"<div class=""text-justify"">

In the beginning, food can be very delicious, good to look at, smell nice, and look like it is never going to change its look but remember, Good food doesn't last forever. When foods start to spoil, depending on the type of food, the first sign you would see is mold. Let's have a post of ""Nothing Good Last Forever"".
____
_____
#### <div class=""phishy""><center>It is a moldy day</center></div>
____
_____
Mold is usually common but not singular to bread. Mold can be found in a lot of food but there is a difference as some can be eaten, like Blue cheese, while molds from bread should not be eaten. The question that comes to mind next is why?


https://freerangestock.com/sample/87250/photo.jpg</div>
<sub><a href=""https://freerangestock.com/photos/87662/photo-details.html"">Free Range Stock</a></sub></center></div>

Molds are microscopic fungi that grow from tiny spores of 3 to 4 microns long, found everywhere in the air, and start growing when the condition is right for them such as war","{""image"":[""https://freerangestock.com/sample/87250/photo.jpg"",""https://upload.wikimedia.org/wikipedia/commons/7/76/Decomposition01.jpg"",""https://commons.wikimedia.org/wiki/File:Decomposition01.jpg""],""tags"":[""hive-196387"",""spoilage"",""food"",""stemgeeks"",""neoxian"",""stemng"",""proofofbrain"",""waivio"",""cent"",""alive""],""description"":""In the beginning, food can be very delicious, good to look at, smell nice, and look like it is never going to change its look but remember, Good food doesn't last forever. When foods start to spoil, depending"",""app"":""ecency/3.0.35-vision"",""format"":""markdown+html"",""image_ratios"":[""1.3251"",""1.5006"",0]}",2023-07-19 17:05:06,Nothing Good Lasts Forever: Exploring the Science of Food Spoilage,/hive-196387/@thomisin/nothing-good-lasts-forever-exploring,5
thomisin,caffeine-impact-on-brain-function,Caffeine Impact on Brain Function and  Athletic Performance,hive-196387,"<div class=""text-justify"">

Today, I'm delving into a topic that personally affects me and many others, and that's caffeine.  As a psychoactive substance, I find myself turning to it almost daily for an extra boost when hitting the gym, working at the hospital, or enduring dull meetings. I'm sure many of you can relate to these experiences. In this post, we'll explore the effects of caffeine on athletic performance and its impact on brain function. So let's have a caffeinated post ahead.

https://storage.needpix.com/rsynced_images/coffee-3273545_1280.jpg<sub><a href=""https://www.needpix.com/photo/1292323/coffee-caffeine-espresso"">NeedPix</a></sub></center></div>

#### <div class=""phishy""><center>Caffeine, the Stimulant</center></div>

Caffeine exists in Coffee, Energy drinks, and Sports drinks, but then can it improve athletic performance? Based on the result of a lot of studies, I would say that the answer is yes. Studies showed that caffeine supplementation showed great results on aerobic performance. <sub","{""image"":[""https://storage.needpix.com/rsynced_images/coffee-3273545_1280.jpg"",""https://www.maxpixel.net/static/photo/1x/Female-Woman-Coffee-Hot-Drink-Girl-Caffeine-3026378.jpg""],""tags"":[""hive-196387"",""stem"",""science"",""stemng"",""neoxian"",""stemgeeks"",""waivio"",""cent"",""alive"",""ocdb""],""description"":"""",""app"":""ecency/3.0.34-vision"",""format"":""markdown+html"",""image_ratios"":[""1.5006"",""1.0000""]}",2023-07-17 10:11:18,Caffeine Impact on Brain Function and  Athletic Performance,/hive-196387/@thomisin/caffeine-impact-on-brain-function,3
thomisin,unveiling-the-salty-truth-the,Unveiling the Salty Truth: The Impact of Excessive and No salt intake on Our Health,hive-196387,"<div class=""text-justify"">

Salt plays a vital role as an essential ingredient in food, serving various purposes beyond mere taste. While some individuals add salt to enhance flavor without fully grasping its significance, others recognize its value in supplying essential minerals such as sodium, calcium, potassium, magnesium, zinc, copper, manganese, and selenium. Shockingly, the global average salt intake, estimated by the World Health Organization, stands at 10.8 grams per day, which is twice the recommended daily salt intake of less than 5 grams.

Excessive consumption of salt has been linked to detrimental health effects, including increased heart rate, high blood pressure, stroke, kidney disease, and other cardiovascular conditions. Clearly, excessive salt intake is harmful, but what happens when an individual completely eliminates salt from their diet? Let's delve into this topic without delay and gain insight into the experience of a moderately salty diet.

https://cdn.pixabay.com/photo/2016/08/15/13","{""image"":[""https://cdn.pixabay.com/photo/2016/08/15/13/45/salt-1595442_1280.jpg""],""tags"":[""hive-196387"",""salt"",""stemgeeks"",""neoxian"",""ecency"",""proofofbrain"",""cent"",""bee"",""alive"",""health""],""description"":""Salt plays a vital role as an essential ingredient in food, serving various purposes beyond mere taste. While some individuals add salt to enhance flavor without fully grasping its significance, others"",""app"":""ecency/3.0.34-vision"",""format"":""markdown+html"",""image_ratios"":[0]}",2023-07-13 22:38:57,Unveiling the Salty Truth: The Impact of Excessive and No salt intake on Our Health,/hive-196387/@thomisin/unveiling-the-salty-truth-the,5
thomisin,the-dangers-of-consuming-rubbing,"The Dangers of Consuming Rubbing Alcohol or Methylated Spirit, Understanding the Risks and Health Implications",hive-196387,"<div class=""text-justify"">

Did you remember the post I wrote some days back on Alcohol and its effect on the body? Today, I decided to ask what happens if I decide to drink methylated spirit or rubbing alcohol instead of the usual alcohol. So, join me on this post, and let's have a methylated. somewhat intoxicated post.

https://upload.wikimedia.org/wikipedia/commons/b/b5/Rubbing_Alcohol_%2851013600587%29.jpg<sub><a href=""https://commons.wikimedia.org/wiki/File:Rubbing_Alcohol_%2851013600587%29.jpg"">Wikimedia</a></sub></div>


It is a Friday and you are supposed to be at the club. You know your drink and do not joke with having ethanol in your system unless you are at work. On days that are not weekends, you spend 4 hours after work having 4 to 5 bottles of beer, but on weekends, you prefer to have spirits. You like vodka, gin, tequila, or any other alcohol that is above 15% by volume but this time, you do not have enough cash to go out, so you decided to use that rubbing alcohol or methylated spirit at hom","{""image"":[""https://upload.wikimedia.org/wikipedia/commons/b/b5/Rubbing_Alcohol_%2851013600587%29.jpg"",""https://commons.wikimedia.org/wiki/File:Rubbing_Alcohol_%2851013600587%29.jpg"",""https://cdn.pixabay.com/photo/2012/10/20/06/27/the-customary-62252_1280.jpg""],""tags"":[""hive-196387"",""stem"",""health"",""science"",""isopropyl-alcohol"",""waivio"",""cent"",""bee"",""proofofbrain"",""alcohol""],""description"":"""",""app"":""ecency/3.0.34-vision"",""format"":""markdown+html"",""image_ratios"":[""1.3333"",0,""1.4971""]}",2023-07-11 09:42:24,"The Dangers of Consuming Rubbing Alcohol or Methylated Spirit, Understanding the Risks and Health Implications",/hive-196387/@thomisin/the-dangers-of-consuming-rubbing,4
thomisin,the-urgency-of-financial-education-in-empowering-individuals-for-a-secure-future,The Urgency of Financial Education in Empowering Individuals for a Secure Future,hive-167922,"<div class=""text-justify"">

In the midst of health pandemics, we must also address the financial pandemic of widespread financial illiteracy. Many individuals lack knowledge about money and how it flows within our society. So, how can we identify someone who is financially literate?

Identifying a financially literate person is not an impossible task and shouldn't require much time. A five-minute conversation can reveal whether someone possesses financial literacy or not. One key characteristic of financial literacy is having a well-defined financial goal. Goals should be more than just a fleeting desire to be rich; they should be specific, gradual, and accompanied by a clear timeline and numeric targets.

<center>https://www.maxpixel.net/static/photo/1x/Financial-Education-Financial-Money-Time-And-Money-1132279.png</div>
<sub><a href=""https://www.maxpixel.net/Financial-Education-Financial-Money-Time-And-Money-1132279"">Maxpixel</a></sub></center></div>

Financially literate individuals demonstrate the abilit","{""app"":""leothreads/0.3"",""format"":""markdown"",""tags"":[""hive-167922"",""finance"",""money"",""neoxian"",""waivio"",""cent"",""bee"",""alive"",""ocdb"",""leofinance""],""canonical_url"":""https://leofinance.io/@thomisin/the-urgency-of-financial-education-in-empowering-individuals-for-a-secure-future"",""links"":[""https://www.maxpixel.net/static/photo/1x/Financial-Education-Financial-Money-Time-And-Money-1132279.png</div>"",""https://www.maxpixel.net/Financial-Education-Financial-Money-Time-And-Money-1132279\"">Maxpixel</a></sub></center></div>"",""https://leofinance.io/@thomisin/the-urgency-of-financial-education-in-empowering-individuals-for-a-secure-future)""],""images"":[]}",2023-07-11 06:57:39,The Urgency of Financial Education in Empowering Individuals for a Secure Future,/hive-167922/@thomisin/the-urgency-of-financial-education-in-empowering-individuals-for-a-secure-future,1
thomisin,mindset-for-financial-success-overcoming-barriers-and-embracing-wealth,Mindset for Financial Success: Overcoming Barriers and Embracing Wealth,hive-167922,"<div class=""text-justify"">
""I recently had a conversation with someone who expressed their belief that achieving financial independence was impossible. I was taken aback by their mindset, but I understand that it's a perspective shaped by their own experiences. Welcome to this post, and thank you for joining me today. I'd like to share some valuable insights I've gained from reading various financial books, and I hope you find them engaging and informative.

Over the years, I've had the opportunity to read several finance books, although not an extensive collection. In a single year, I managed to read over 20 books, all of which focused on finance. This has provided me with a wealth of knowledge that I feel compelled to share in this post.

https://images.pexels.com/photos/4475523/pexels-photo-4475523.jpeg</div>
[Pexels](https://www.pexels.com/photo/person-counting-cash-money-4475523/)

Regarding the friend I mentioned earlier, one of the main obstacles she faces is her mindset. It's crucial to overcome our ","{""app"":""leothreads/0.3"",""format"":""markdown"",""tags"":[""hive-167922"",""neoxian"",""finance"",""money"",""mindset"",""waivio"",""cent"",""alive"",""bee"",""leofinance""],""canonical_url"":""https://leofinance.io/@thomisin/mindset-for-financial-success-overcoming-barriers-and-embracing-wealth"",""links"":[""https://images.pexels.com/photos/4475523/pexels-photo-4475523.jpeg</div>"",""https://www.pexels.com/photo/person-counting-cash-money-4475523/)"",""https://pixahive.com/photo/girl-highlighting-lines-in-a-book/)"",""https://leofinance.io/@thomisin/mindset-for-financial-success-overcoming-barriers-and-embracing-wealth)""],""images"":[""https://pixahive.com/wp-content/uploads/2020/10/Girl-highlighting-lines-in-a-book-132188-pixahive.jpg""]}",2023-07-03 03:04:09,Mindset for Financial Success: Overcoming Barriers and Embracing Wealth,/hive-167922/@thomisin/mindset-for-financial-success-overcoming-barriers-and-embracing-wealth,0
thomisin,my-looming-nightmare-the-growing,My Looming Nightmare- The Growing Threat of Antibiotic-Resistant Bacteria,hive-196387,"<div class=""text-justify"">

Everyone has their worst nightmares in the form of disasters. For some people, it is a meteor strike, dinosaur apocalypse, super volcanoes, third world war, or even an unknown war, and for some, it is Artificial intelligence and climate change, but for me, one of my greatest nightmares is having a world where we have antibiotic-resistant bacteria with no solution.

If you are reading this post, there is a chance that at a point in time, an antibiotic has saved your life by tackling and killing that bacteria. Since the discovery of Penicillin, humans have lived longer compared to before that. If you believe that without antibiotics we would be living long, then let me remind you of the Black Death pandemic that killed millions of people in Europe and Asia as a result of no antibiotics to treat *Yersinia pestis*. If you were asked if such a pandemic can occur again, you would say **NO**.

https://upload.wikimedia.org/wikipedia/commons/2/25/Antimicrobial_resistance.jpg</div><sub><a h","{""image"":[""https://upload.wikimedia.org/wikipedia/commons/2/25/Antimicrobial_resistance.jpg"",""https://commons.wikimedia.org/wiki/File:Antimicrobial_resistance.jpg"",""https://upload.wikimedia.org/wikipedia/commons/6/61/Antibiotic_resistance_mechanisms.jpg"",""https://commons.wikimedia.org/wiki/File:Antibiotic_resistance_mechanisms.jpg""],""tags"":[""hive-196387"",""stemsocial"",""stemgeeks"",""neoxian"",""ocdb"",""science"",""stemng"",""bacteria"",""waivio"",""cent""],""description"":"""",""app"":""ecency/3.0.33-vision"",""format"":""markdown+html"",""image_ratios"":[""1.5006"",0,""1.4151"",0]}",2023-06-30 23:48:48,My Looming Nightmare- The Growing Threat of Antibiotic-Resistant Bacteria,/hive-196387/@thomisin/my-looming-nightmare-the-growing,1
thomisin,the-illegal-business-of-woman,The Illegal Business of Woman Trafficking in Nigeria,hive-174578,"<div class=""text-justify"">

I was with a lady yesterday and I was very touched after she told me her story. It was a very depressing one, and although I could not understand what she had been through, I was able to see her pain. She narrated how she was forced to trafficking and how she escaped to get back to Nigeria. A lot of people will not go to the police station to report this case, and so many of them just want to start a fresh life instead of fighting with people they believe are more powerful than they are.

<center>https://live.staticflickr.com/5518/14524584114_bd02ac629d_z.jpg</div>
<sub><a href=""https://www.flickr.com/photos/121483302@N02/14524584114"">Flickr</a></sub></center></div>


It is true that whatever country a Nigerian is not living in has nothing good to offer. Nigerians are virtually everywhere around the globe, and there is a possibility that you know a Nigerian and you associate yourself with one. While so many go abroad legally, there is a large percentage of Nigerians that are traff","{""image"":[""https://live.staticflickr.com/5518/14524584114_bd02ac629d_z.jpg"",""https://cdn2.picryl.com/photo/2015/03/27/ctip-aims-to-stop-traffic-b86523-1024.jpg""],""tags"":[""hive-174578"",""writing"",""woman-trafficking"",""gem"",""neoxian"",""bee"",""alive"",""woman"",""lifestyle"",""proofofbrain""],""description"":"""",""app"":""ecency/3.0.31-vision"",""format"":""markdown+html"",""image_ratios"":[1.3333333333333333,1.5036710719530102]}",2023-05-11 18:12:09,The Illegal Business of Woman Trafficking in Nigeria,/hive-174578/@thomisin/the-illegal-business-of-woman,2
