author,permlink,title,category,body,json_metadata,created,root_title,url,children
thomisin,unlike-what-you-think-plants,"Unlike What You Think, Plants Cooperate and Communicate",hive-196387,"<div class=""text-justify"">

For over 400 million years, trees have stood as silent witnesses to the ever-changing world. They possess the extraordinary ability to break down rocks, create soil, and harness carbon dioxide from the air, transforming it into the precious oxygen we breathe. Unfathomably resilient, trees have weathered four mass extinction events, all while rooted in place, never straying from their designated spots. Trees are enigmatic entities, vastly different from us humans. We rely on blood, lymphatic systems, and complex brains while nourishing ourselves with a diverse diet. Trees, on the other hand, flourish with sunlight and water, steadfastly growing year after year, often surviving for centuries.

When trees are in the forest, they look like single individuals fighting for sun, and water and really do not communicate with one another but this is wrong. When we look deep down into plant, we would understand that plants and trees communicate with themselves, they share resources, and shar","{""image"":[""https://c.pxhere.com/images/e2/5d/24318b0342f1067931d049bf791f-1606550.jpg!d"",""https://live.staticflickr.com/5107/5581053207_ebb4a76e4b_b.jpg""],""tags"":[""hive-196387"",""stemng"",""stemgeeks"",""neoxian"",""proofofbrain"",""botany"",""waivio"",""cent"",""bee"",""alive""],""description"":""For over 400 million years, trees have stood as silent witnesses to the ever-changing world. They possess the extraordinary ability to break down rocks, create soil, and harness carbon dioxide from the"",""app"":""ecency/3.0.36-vision"",""format"":""markdown+html"",""image_ratios"":[""1.3333"",""1.3545""]}",2023-10-17 22:20:15,"Unlike What You Think, Plants Cooperate and Communicate",/hive-196387/@thomisin/unlike-what-you-think-plants,2
thomisin,electric-bandages-and-wound-healing,Electric Bandages and Wound Healing ,hive-196387,"<div class=""text-justify"">

Wounds are an inevitable part of our human experience, given that our skin is a fleshy and vulnerable barrier. The skin, our body's largest organ, plays a crucial role in protecting our vessels, blood capillaries, and internal organs. It acts as a shield against external elements, such as sunlight and pressure, and enables us to perceive sensations like warmth and pain.

In doing our daily activities and trying to survive, the skin would experience cuts, burns, scrapes, bruises and so on, and one thing we want is healing, we want our wounds to heal up, creating scar tissues and allowing us to do our other activities. While the body can heal up by itself, there are cases where it will not be able to do this by itself, and would require bandages to help treat the wound and with modern research with microbiology, and bio-engineering brought about electric bandages.

https://images.rawpixel.com/image_800/czNmcy1wcml2YXRlL3Jhd3BpeGVsX2ltYWdlcy93ZWJzaXRlX2NvbnRlbnQvbHIvYTAxMC1tYXJrdXNzc","{""image"":[""https://images.rawpixel.com/image_800/czNmcy1wcml2YXRlL3Jhd3BpeGVsX2ltYWdlcy93ZWJzaXRlX2NvbnRlbnQvbHIvYTAxMC1tYXJrdXNzcGlza2Utb2N0MTgtMDM2LmpwZw.jpg?s=b-CmkeJ6asgQPiPgwMM8Gm7OHAq08LyQMKV-EKYLRko"",""https://images.rawpixel.com/image_png_800/czNmcy1wcml2YXRlL3Jhd3BpeGVsX2ltYWdlcy93ZWJzaXRlX2NvbnRlbnQvam9iNjgwLTE3Ni1wLWwxZGJ1cTQ2LnBuZw.png?s=Q7G7FweJ1QSTJ_tljIOPQbdfF3WBmRhJQbrNki3sRL0""],""tags"":[""hive-196387"",""stemng"",""stemgeeks"",""neoxian"",""ocdb"",""health"",""waivio"",""cent"",""alive"",""bee""],""description"":""Wounds are an inevitable part of our human experience, given that our skin is a fleshy and vulnerable barrier. The skin, our body's largest organ, plays a crucial role in protecting our vessels, blood"",""app"":""ecency/3.0.36-vision"",""format"":""markdown+html"",""image_ratios"":[""1.5009"",""1.5009""]}",2023-10-13 17:28:00,Electric Bandages and Wound Healing ,/hive-196387/@thomisin/electric-bandages-and-wound-healing,3
thomisin,drinking-alcohol-and-its-effects,Drinking Alcohol and its Effects in the Day vs. at Night,hive-196387,"<div class=""text-justify"">

About 80% of all adults have taken alcohol at one point in their lives, and a lot of people cannot do without the beverage, making it the beverage to unwind but then, alcohol is a drug that decreases neuronal excitation in the brain and releases Acetaldehyde and other byproduct that impacts the body.

So many people take alcohol in the morning, while some other people take it at night. Some people have argued that it is not a good time to take alcohol at night, while some believes that taking it at night before going to bed is the best.

https://cdn.stocksnap.io/img-thumbs/960w/beer-alcohol_92L9O25OTZ.jpg
<sup>[stocksnap](https://stocksnap.io/photo/beer-alcohol-92L9O25OTZ)</sup>

When you consume alcohol, about 20% is absorbed in the stomach, with the remaining 80% making its way into the bloodstream through the small intestine. It then journeys to the liver for metabolism. It gets into the cell by passive diffusion thereby causing a increase rate in getting drunk faster when cons","{""image"":[""https://cdn.stocksnap.io/img-thumbs/960w/beer-alcohol_92L9O25OTZ.jpg"",""https://cdn2.picryl.com/photo/2020/09/03/study-prompts-re-emphasis-on-alcohol-abuse-treatment-options-e0a608-1024.jpg""],""tags"":[""hive-196387"",""stem"",""stemng"",""neoxian"",""stamgeeks"",""proofofbrain"",""waivio"",""cent"",""bee"",""alive""],""description"":""About 80% of all adults have taken alcohol at one point in their lives, and a lot of people cannot do without the beverage, making it the beverage to unwind but then, alcohol is a drug that decreases neuronal"",""app"":""ecency/3.0.36-vision"",""format"":""markdown+html"",""image_ratios"":[""1.5000"",""1.7778""]}",2023-10-05 09:41:00,Drinking Alcohol and its Effects in the Day vs. at Night,/hive-196387/@thomisin/drinking-alcohol-and-its-effects,5
thomisin,gut-microbiome-and-the-role,Gut Microbiome and The Role of Probiotics in Health and Diseases,hive-196387,"<div class=""text-justify"">

For many years, bacteria have had a bad reputation. They've been linked to numerous health conditions, and the mere mention of the word 'bacteria' often conjures thoughts of disease. However, recent news and publications have shed light on their potential health benefits. Studies have revealed that the bacteria residing in our guts play a crucial role in our overall well-being. Consequently, we've seen a surge in the consumption of probiotics aimed at improving gut microbiota.

You must have heard of probiotics, because I have heard of them. If you have or haven't, let's look at understanding what they are and if they truly work in keep our gut microbiota and make a difference after taking them, or they are just some things that have no significant effect.

https://live.staticflickr.com/3668/13621543955_6be72d0f3c_b.jpg</div>
<sup>[Flickr](https://www.flickr.com/photos/ryansnyder/13621543955)</sup>

Humans are made up of more microorganisms than cells, so we house a lot of this mi","{""image"":[""https://live.staticflickr.com/3668/13621543955_6be72d0f3c_b.jpg"",""https://upload.wikimedia.org/wikipedia/commons/7/75/Microbiome_Sites_%2827058471125%29.jpg"",""https://commons.wikimedia.org/wiki/File:Microbiome_Sites_%2827058471125%29.jpg""],""tags"":[""hive-196387"",""stemng"",""stemgeeks"",""bacteria"",""neoxian"",""waivio"",""cent"",""proofofbrain"",""ocdb"",""bee""],""description"":""For many years, bacteria have had a bad reputation. They've been linked to numerous health conditions, and the mere mention of the word 'bacteria' often conjures thoughts of disease. However, recent news"",""app"":""ecency/3.0.36-vision"",""format"":""markdown+html"",""image_ratios"":[0,""1.3959"",0]}",2023-10-02 13:39:39,Gut Microbiome and The Role of Probiotics in Health and Diseases,/hive-196387/@thomisin/gut-microbiome-and-the-role,3
thomisin,our-body-continually-fighting-cancer,Our Body Continually Fighting Cancer Cells,hive-196387,"<div class=""text-justify"">

Humans are a remarkable amalgamation of countless cells, with the average person boasting an astounding 30 trillion cells, complemented by an additional 40 trillion bacteria thriving within our digestive tract. Although our bodies consist of trillions of cells, they do not always operate in perfect harmony to sustain our well-being. Within this intricate symphony of cellular activity, some cells seem determined to seize nutrients for themselves, often taking the form of mutated cells that defy regulation and continue to proliferate. These rogue cells, aptly known as cancer cells, persistently expand and endeavor to develop tumors. It's a continuous struggle within our bodies, with one cell or another occasionally going rogue. However, our bodies have evolved robust defense mechanisms to counteract such deviations.


![Cancers_-_Cells_-_Normal_cells_Cancerous_cells_--_Smart-Servier.jpg](https://images.hive.blog/DQmRarbbcu1DtQgD4P8LVXtV4jFx3NZ4if8bXrTbRFbCFV2/Cancers_-_Cells_-_Norma","{""image"":[""https://images.hive.blog/DQmRarbbcu1DtQgD4P8LVXtV4jFx3NZ4if8bXrTbRFbCFV2/Cancers_-_Cells_-_Normal_cells_Cancerous_cells_--_Smart-Servier.jpg"",""https://commons.wikimedia.org/wiki/File:Cancers_-_Cells_-_Normal_cells_Cancerous_cells_--_Smart-Servier.jpg"",""https://live.staticflickr.com/7644/27025657466_6707e2d262_b.jpg""],""tags"":[""hive-196387"",""stemng"",""stemgeeks"",""neoxian"",""proofofbrain"",""waivio"",""cent"",""bee"",""alive"",""genetics""],""description"":""Owning a pet has become a common feature in many households today. People embrace the companionship of domesticated animals, which typically includes dogs, cats, rabbits, and various other furry creatures."",""app"":""ecency/3.0.36-vision"",""format"":""markdown+html"",""image_ratios"":[""1.7778"",0,""1.3333""]}",2023-09-28 14:09:57,Our Body Continually Fighting Cancer Cells,/hive-196387/@thomisin/our-body-continually-fighting-cancer,3
thomisin,how-cigarette-moved-from-being,How Cigarette moved from being a Medical Wonder to Being Linked to Cancer,hive-196387,"<div class=""text-justify"">

We've all heard the ominous warning that ""smoking causes cancer,"" but have you ever wondered how this dire connection was established? Let's take a journey back in time to explore the origins of this critical discovery. It was in 1964 when the President of the American Cancer Society first uttered those fateful words, but the journey to that moment was a complex one.

There was a report published in the same year titled Smoking and Health that explained how smoking caused lots of diseases and since then, there have been different labels on cigarettes and you must have seen a lot of them, depending on the country you live in. In the 50s, there were a lot of studies pointing to a link between smoking and cancer but how did we get to that conclusion?

https://images.pexels.com/photos/5812982/pexels-photo-5812982.jpeg</div>
<sup>[pexels](https://www.pexels.com/photo/a-close-up-shot-of-a-person-smoking-a-cigarette-5812982/)</sup>

Tobacco has been used medicinally for thousands of year","{""image"":[""https://images.pexels.com/photos/5812982/pexels-photo-5812982.jpeg"",""https://upload.wikimedia.org/wikipedia/commons/d/db/Vietnam_Under_French_Rule%2C_20th_Century%2C_Opium_Smoking_Set_%289735501443%29.jpg"",""https://commons.wikimedia.org/wiki/File:A_set_for_smoking_opium,_Nguyen_dynasty,_20th_century,_wood,_metal,_porcelain_-_National_Museum_of_Vietnamese_History_-_Hanoi,_Vietnam_-_DSC05594.JPG""],""tags"":[""hive-196387"",""stemng"",""neoxian"",""stem"",""stemgeeks"",""cigarette"",""proofofbrain"",""cent"",""alive"",""waivio""],""description"":""The concept of libido, which encompasses one's sexual desire, drive, and overall interest in sexual activity, is a term that's widely recognized. In this discussion, however, we'll set aside the explicit"",""app"":""ecency/3.0.36-vision"",""format"":""markdown+html"",""image_ratios"":[""1.5041"",""1.5006"",0]}",2023-09-24 20:24:48,How Cigarette moved from being a Medical Wonder to Being Linked to Cancer,/hive-196387/@thomisin/how-cigarette-moved-from-being,2
thomisin,a-look-at-living-organisms,A Look at Living Organisms and Intelligence,hive-196387,"<div class=""text-justify"">

Human pride often centers on our intelligence, which we view as a remarkable trait akin to physical strength. However, articulating the essence of this characteristic in simple terms proves challenging. The most straightforward way to define intelligence is as the ability to solve problems. Yet, when we question how our intelligence has benefited us, responses often revolve around accomplishments like constructing advanced vehicles. In reality, the core function of our intelligence has always been survival, encompassing basic tasks such as acquiring sustenance, securing shelter, seeking mates, evading predators, and hunting prey.


https://images.pixexid.com/a-brain-with-a-black-background-nqq9t2ry.jpeg</div>
<sup>[pixexid](https://pixexid.com/image/a-brain-with-a-black-background-nqq9t2ry)</sup>

Intelligence is a multifaceted concept encompassing the capacity to accumulate knowledge, learn, enhance our knowledge, strategize, and engage in critical thinking. It can manifest throu","{""image"":[""https://images.pixexid.com/a-brain-with-a-black-background-nqq9t2ry.jpeg"",""https://upload.wikimedia.org/wikipedia/commons/b/b8/Physarum_polycephalum_25573047.jpg"",""https://commons.wikimedia.org/wiki/File:Physarum_polycephalum_25573047.jpg"",""https://cdn.steemitimages.com/DQmaKRNsSff5E66n6ZR6zrSu47pTuZMSK4qMVkGLSuXSogQ/raccoon.jpg""],""tags"":[""hive-196387"",""stemng"",""stemgeeks"",""neoxian"",""proofofbrain"",""waivio"",""cwnt"",""bee"",""aive"",""psychology""],""description"":""Human pride often centers on our intelligence, which we view as a remarkable trait akin to physical strength. However, articulating the essence of this characteristic in simple terms proves challenging."",""app"":""ecency/3.0.36-vision"",""format"":""markdown+html"",""image_ratios"":[""1.5006"",""1.3319"",0,""1.4992""]}",2023-09-20 23:50:36,A Look at Living Organisms and Intelligence,/hive-196387/@thomisin/a-look-at-living-organisms,3
thomisin,when-foreign-objects-go-astray,When Foreign Objects Go Astray in the Body,hive-196387,"<div class=""text-justify"">

Yesterday, I decided to pay a visit to my aunt, hoping for a cheerful reunion. However, upon seeing her, it was evident that something was amiss. Instead of radiating her usual positivity, she appeared to be in pain, the result of an unfortunate encounter with a nail. Her distress was compounded by her deep-seated fear of needles, nails, and anything sharp with a pointed tip. In this case, she had just received a Tetanus injection, and the ordeal had left her trembling. She made a statement that if it was a needle, it could have been worse because it could get lost in her foot.



https://live.staticflickr.com/433/20116542775_bb1c7aa166_b.jpg</div>
<sup>[Flickr](https://www.flickr.com/photos/134316669@N05/20116542775)</sup>

The mere thought of needles can send shivers down the spines of many, and witnessing one piercing the skin unexpectedly can be a nerve-wracking experience. My aunt made an illustration that, imagine she was working and was stabbed by a needle, there is a proba","{""image"":[""https://live.staticflickr.com/433/20116542775_bb1c7aa166_b.jpg"",""https://upload.wikimedia.org/wikipedia/commons/2/2f/Foreign_body_aspiration.jpg"",""https://commons.wikimedia.org/wiki/File:Foreign_body_aspiration.jpg""],""tags"":[""hive-196387"",""stemng"",""stemgeeks"",""neoxian"",""anatomy"",""science"",""proofofbrain"",""waivio"",""cent"",""bee""],""description"":""Yesterday, I decided to pay a visit to my aunt, hoping for a cheerful reunion. However, upon seeing her, it was evident that something was amiss. Instead of radiating her usual positivity, she appeared"",""app"":""ecency/3.0.36-vision"",""format"":""markdown+html"",""image_ratios"":[""1.4993"",""1.2736"",0]}",2023-09-17 13:03:12,When Foreign Objects Go Astray in the Body,/hive-196387/@thomisin/when-foreign-objects-go-astray,1
thomisin,foreign-accent-syndrome-when-having,Foreign Accent Syndrome: When Having Foreign Accent Goes Wrong,hive-196387,"<div class=""text-justify"">

In the realm of neuroscience and the study of neurological defects, one can't help but be captivated by the intricate workings of the human brain. These defects, although often distressing, provide a window into the astonishing capabilities and resilience of this organ. Among the myriad of neurological conditions that have puzzled researchers, Foreign Accent Syndrome stands out as a particularly intriguing and enigmatic phenomenon. Yes, you read that correctly, Foreign Accent Syndrome.

It can be very funny to have a migraine or even a minor head injury which would then lead to the speaking of foreign accents of countries you have never been to and this scenario nullifies the Critical Period Hypothesis which hypothesizes that a learning a language is done within a period of time especially in the early years of life.

https://creazilla-store.fra1.digitaloceanspaces.com/cliparts/3152786/mental-health-clipart-md.png</div>
<sup>[creazilla](https://creazilla.com/nodes/3152786-mental-h","{""image"":[""https://creazilla-store.fra1.digitaloceanspaces.com/cliparts/3152786/mental-health-clipart-md.png"",""https://upload.wikimedia.org/wikipedia/commons/3/3c/Headache_touching_forehead.jpg""],""tags"":[""hive-196387"",""stemng"",""stemgeeks"",""neoxian"",""waivio"",""neurology"",""cent"",""alive"",""bee"",""proofofbrain""],""description"":""In the realm of neuroscience and the study of neurological defects, one can't help but be captivated by the intricate workings of the human brain. These defects, although often distressing, provide a window"",""app"":""ecency/3.0.36-vision"",""format"":""markdown+html"",""image_ratios"":[""1.1713"",""1.5006""]}",2023-09-14 22:10:51,Foreign Accent Syndrome: When Having Foreign Accent Goes Wrong,/hive-196387/@thomisin/foreign-accent-syndrome-when-having,4
thomisin,hydrogen-peroxide-therapy-a-life,Hydrogen Peroxide Therapy; A Life Saver or Fallacy,hive-196387,"<div class=""text-justify"">

The simplest naturally occurring peroxide molecule is Hydrogen peroxide, composed of two oxygen atoms bonded to two hydrogen atoms (H₂O₂). Peroxide molecules serve various purposes, including use in cosmetic products and disinfectants, but not as a health supplement.
  

As a child, my mum would use hydrogen peroxide on every wound and even to wash our mouth but would make sure we didn't drink it. Actually, those clinic based hydrogen peroxides includes stabilizers such as phenol, tetrasodiumphosphate, and sodium stannate, so they were not advised to be swallowed. But it has become a thing as a lot of people now use hydrogen peroxide therapy, and if you check online, you would see different blogs with no references on hydrogen peroxide therapy, so today, I will be looking into their claims and why they are wrong.

<center>https://live.staticflickr.com/8527/8455126916_4ee7214195_b.jpg
<sub><a href=""https://www.flickr.com/photos/trentenkelleyphotography/8455126916"">Flickr</a></sub><","{""image"":[""https://live.staticflickr.com/8527/8455126916_4ee7214195_b.jpg""],""tags"":[""hive-196387"",""stemng"",""stem"",""proofofbrain"",""neoxian"",""waivio"",""cent"",""ocdb"",""alive"",""bee""],""description"":"""",""app"":""ecency/3.0.36-vision"",""format"":""markdown+html"",""image_ratios"":[""0.6670""]}",2023-09-02 08:53:18,Hydrogen Peroxide Therapy; A Life Saver or Fallacy,/hive-196387/@thomisin/hydrogen-peroxide-therapy-a-life,3
thomisin,paving-your-way-to-financial-stability,Paving Your Way to Financial Stability,hive-167922,"<div class=""text-justify"">

Greetings, everyone. I'd like to share some valuable insights today that can pave the way to financial stability. So, let's dive right in.

First and foremost, it's crucial to understand that the cornerstone of financial success is effective budgeting. Financial management hinges on this practice, as it serves as your financial compass. Budgeting provides an overview of your income and outlines your planned expenditures. Regularly reviewing and refining your budget helps pinpoint areas where you can optimize your financial resources.

https://images.pexels.com/photos/6958537/pexels-photo-6958537.jpeg
<sub><a href=""https://www.pexels.com/photo/young-man-reading-a-book-and-studying-6958537/"">Pexels</a></sub></center></div>

Another lesson to be learnt is the power in frugality. Cultivating a frugal personality helps to master the act of discerning and constraints instead of spending without caution. It has to do with continuously patting ways with immediate gratification, and holdin","{""app"":""leothreads/0.3"",""format"":""markdown"",""tags"":[""hive-167922"",""finance"",""neoxian"",""ocdb"",""leocub"",""leo"",""waivio"",""cent"",""alive"",""leofinance""],""canonical_url"":""https://leofinance.io/@thomisin/paving-your-way-to-financial-stability"",""links"":[""https://www.pexels.com/photo/young-man-reading-a-book-and-studying-6958537/\"">Pexels</a></sub></center></div>"",""https://leofinance.io/@thomisin/paving-your-way-to-financial-stability)""],""images"":[""https://images.pexels.com/photos/6958537/pexels-photo-6958537.jpeg""]}",2023-08-26 01:02:36,Paving Your Way to Financial Stability,/hive-167922/@thomisin/paving-your-way-to-financial-stability,1
thomisin,atherosclerosis-and-plaque-buildup-in,Atherosclerosis and Plaque Buildup in Ischemic Heart Disease,hive-196387,"<div class=""text-justify"">

Ischemic Heart Disease, often referred to as a heart attack or myocardial infarction, stands as the leading cause of death globally, surpassing even cancer, car accidents, and strokes. It's no surprise that the phrase ""do not give me a heart attack"" is a common expression in Nigeria, used by many to convey their desire for a stress-free existence.

Heart attack is caused by atherosclerosis or plaque buildup in the arteries. Where there are arteries that supply blood to the body, the heart has its own arteries known as the coronary artery. Its job is to deliver blood and oxygen to the heart itself. Remember that the heart is a working muscle that works from the day you are born till the day you die, and a heart attack occurs when the coronary artery is blocked stopping oxygen, and blood from getting to the heart. The artery isn't that large in diameter as it is about 4 millimeters in diameter, and can be blocked when the arterial wall ruptures as a result of plaque buildup within t","{""image"":[""https://upload.wikimedia.org/wikipedia/commons/6/64/Myocardial_infarction.jpg"",""https://commons.wikimedia.org/wiki/File:Myocardial_infarction.jpg""],""tags"":[""hive-196387"",""stemng"",""stemgeeks"",""ocdb"",""neoxian"",""health"",""waivio"",""cent"",""bee"",""alive""],""description"":"""",""app"":""ecency/3.0.36-vision"",""format"":""markdown+html"",""image_ratios"":[""1.7778"",0]}",2023-08-22 09:16:21,Atherosclerosis and Plaque Buildup in Ischemic Heart Disease,/hive-196387/@thomisin/atherosclerosis-and-plaque-buildup-in,2
thomisin,revolutionizing-cancer-treatment-chemotherapy-and,Revolutionizing Cancer Treatment: Chemotherapy and Targeted Therapies,hive-196387,"<div class=""text-justify"">

The battle against cancer has long involved the use of chemotherapy, a powerful treatment that aims to disrupt the metabolic activity within cancer cells, ultimately leading to their demise. However, while chemotherapy has proven effective in combating cancer, its side effects have made it a challenging option for many patients. In this video, we delve into the world of cancer treatment, exploring the nuances of chemotherapy and the evolving landscape of targeted therapies.

Chemotherapy has been a lifesaver for a lot of cancer patients, and it is the use of drugs to treat cancer. With Chemo, a patient can get one or a combination of different drugs to tackle the cancer. Its use also depends on what it is expected to do, as some would kill the cancer cells completely, while others would make it easy for surgical procedures to be possible. There are also times when a chemo is done to manage patient symptoms when a cure isn't visible.

https://upload.wikimedia.org/wikipedia/commons/","{""image"":[""https://upload.wikimedia.org/wikipedia/commons/8/88/Glivec_400mg.jpg"",""https://commons.wikimedia.org/wiki/File:Glivec_400mg.jpg"",""https://upload.wikimedia.org/wikipedia/commons/3/3c/Mammographie-cancer.jpg"",""https://commons.wikimedia.org/wiki/File:Mammographie-cancer.jpg""],""tags"":[""hive-196387"",""stemng"",""stemgeeks"",""neoxian"",""ocdb"",""gem"",""waivio"",""cent"",""alive"",""chemotherapy""],""description"":""The battle against cancer has long involved the use of chemotherapy, a powerful treatment that aims to disrupt the metabolic activity within cancer cells, ultimately leading to their demise. However, while"",""app"":""ecency/3.0.36-vision"",""format"":""markdown+html"",""image_ratios"":[""1.4392"",0,""1.5833"",0]}",2023-08-18 21:31:18,Revolutionizing Cancer Treatment: Chemotherapy and Targeted Therapies,/hive-196387/@thomisin/revolutionizing-cancer-treatment-chemotherapy-and,3
