author,permlink,title,category,body,json_metadata,created,root_title,url,children
thomisin,a-deep-dive-into-its,A Deep Dive into Its Intricate Mechanisms of Sleep Paralysis,hive-196387,"<div class=""text-justify"">

For a lot of us, we have had this experience where we wake up but cannot move because there is a demon-like figure on our chest preventing us from talking or holding our breath. This is a legitimate possibility for over 7% of he human population, and it is known as sleep paralysis. So in this post, I will be writing about what happens to the body during sleep paralysis.

Sleep paralysis falls under the umbrella of sleep disorders known as Parasomnia, sharing space with other disorders like Sleepwalking, Nocturnal Seizures, and night terrors. Specifically, sleep paralysis is categorized as a rapid eye movement (REM) parasomnia. Understanding REM sleep is crucial, as it's the stage where dreams unfurl with rapid eye movements beneath closed eyelids.

<center>https://live.staticflickr.com/5460/8842882339_c2586ddff6.jpg</div>
[flickr](https://www.flickr.com/photos/1000photosofnewyorkcity/8842882339)</center>

During REM sleep, the skeletal muscles remain atonic, rendering them tempora","{""image"":[""https://live.staticflickr.com/5460/8842882339_c2586ddff6.jpg"",""https://storage.needpix.com/rsynced_images/neurons-3743011_1280.jpg""],""tags"":[""hive-196387"",""stemng"",""sleep"",""neurology"",""neoxian"",""waivio"",""proofofbrain"",""cent"",""alive"",""bee""],""description"":""For a lot of us, we have had this experience where we wake up but cannot move because there is a demon-like figure on our chest preventing us from talking or holding our breath. This is a legitimate"",""app"":""ecency/3.0.37-vision"",""format"":""markdown+html"",""image_ratios"":[""1.5432"",""1.4191""]}",2023-11-14 00:02:36,A Deep Dive into Its Intricate Mechanisms of Sleep Paralysis,/hive-196387/@thomisin/a-deep-dive-into-its,1
thomisin,the-unseen-peril-exploring-the,The Unseen Peril: Exploring the Deadly Impact of Rabies in Humans,hive-196387,"<div class=""text-justify"">

On the fateful night of July 27, 2020, a man experienced a chilling encounter that would turn his peaceful dwelling into a semi-horror scene. Awaking in the dark hours, he found a bat within the confines of his home. The eerie episode took a terrifying turn when the bat unleashed screeches and sank its teeth into the man's hand. What followed was the onset of symptoms that hinted at a disease notorious for its severity, and that disease is rabies.

When it comes to diseases that can be transmitted from animals to humans, Rabies hold a high position when it comes to severity of manifestation. From Foxes, Dogs, Bats, and to getting it from organ transplant, Rabies has found its way into the live of many, and it is not a joke, trust me when I say it.


https://cdn2.picryl.com/photo/1958/12/31/manwithrabies7-1cee76-1024.png</div>
[picryl](https://picryl.com/media/manwithrabies7-1cee76)

While it has a very severe manifestation, the chance of getting rabies is very slim, and that is go","{""image"":[""https://cdn2.picryl.com/photo/1958/12/31/manwithrabies7-1cee76-1024.png"",""https://live.staticflickr.com/144/326495027_1afad24394_b.jpg"",""https://www.downbeach.com/wp-content/uploads/2022/03/1621949479_gWGMxS_COVID_In_Animals.jpeg""],""tags"":[""hive-196387"",""stemng"",""stemgeeks"",""neoxian"",""proofofbrain"",""waivio"",""cent"",""alive"",""bee"",""health""],""description"":""On the fateful night of July 27, 2020, a man experienced a chilling encounter that would turn his peaceful dwelling into a semi-horror scene. Awaking in the dark hours, he found a bat within the confines"",""app"":""ecency/3.0.37-vision"",""format"":""markdown+html"",""image_ratios"":[""1.5193"",""1.3333"",""1.8511""]}",2023-12-09 01:16:27,The Unseen Peril: Exploring the Deadly Impact of Rabies in Humans,/hive-196387/@thomisin/the-unseen-peril-exploring-the,1
thomisin,decoding-life-a-biologist-s,Decoding Life: A Biologist's Perspective,hive-196387,"<div class=""text-justify"">

What is life? This is one question that a lot of people have given lots of meaning to, depending on their understanding and belief, but in this post, I will be explaining life like a scientist should, or better still as a biologist should. Explaining life is not easy in one sentence as it encompasses a lot of things as there are many features that make us living but first, we would start with Cells.

In the 17th century, Anton Van Leeuwenhoek and Robert Hooke used microscope to identify cells as the basic unit of life. Today, we know that all organisms are made up of cells. While cells can differ from one another, one thing is clear that all cells no matter their look have membranes. Living organisms are very unique, and they almost do not follow second law of thermodynamics that states that heat does not naturally flow from a cool body to a warmer; work must be expended to make it do so. While non living organisms are able to release heat to the environment until they reaches roo","{""image"":[""https://www.embl.org/news/wp-content/uploads/2021/09/CompositionBact_final-1000x600-1.jpg"",""https://upload.wikimedia.org/wikipedia/commons/8/8e/Difference_DNA_RNA-IT.svg"",""https://commons.wikimedia.org/wiki/File:Difference_DNA_RNA-IT.svg""],""tags"":[""hive-196387"",""life"",""stemng"",""science"",""neoxian"",""proofofbrain"",""stemgeeks"",""waivio"",""cent"",""alive""],""description"":""What is life? This is one question that a lot of people have given lots of meaning to, depending on their understanding and belief, but in this post, I will be explaining life like a scientist should,"",""app"":""ecency/3.0.37-vision"",""format"":""markdown+html"",""image_ratios"":[""1.6667"",""1.2500"",0]}",2023-12-12 17:09:18,Decoding Life: A Biologist's Perspective,/hive-196387/@thomisin/decoding-life-a-biologist-s,2
thomisin,what-happens-when-you-donate,What Happens When You Donate Blood,hive-196387,"<div class=""text-justify"">

Depending on the hospital at which you work, or the country where you live, there is a code for emergency cases where patients are losing blood and require blood immediately. In some countries it is regarded as Code Omega, while some call it code orange. Depending on the country and the codes used, there are cases where patients are rushed into the hospital and will require blood transfusion as soon as possible as the patients survival depends on giving them blood as soon as possible.

When this code is given in a hospital, the blood lab will immediately begin work, sending one package/pint of blood after another depending on the amount needed. At this point, every seconds count when talking about delivering the blood to the patient, also, giving the patient the right type of blood matters a lot, and that depends on the blood type available. Any mistake with this blood is a factor between life and death.

https://images.rawpixel.com/image_800/czNmcy1wcml2YXRlL3Jhd3BpeGVsX2ltYWdlcy","{""image"":[""https://images.rawpixel.com/image_800/czNmcy1wcml2YXRlL3Jhd3BpeGVsX2ltYWdlcy93ZWJzaXRlX2NvbnRlbnQvbHIvZmw0OTc1NTE4OTUzNy1pbWFnZS1rdWNjczd6bC5qcGc.jpg"",""https://www.publicdomainpictures.net/pictures/400000/nahled/blood-donation-1621661174Axr.jpg""],""tags"":[""hive-196387"",""stemng"",""stemgeeks"",""proofofbrain"",""neoxian"",""neoxag"",""cent"",""waivio"",""alive"",""health""],""description"":""Depending on the hospital at which you work, or the country where you live, there is a code for emergency cases where patients are losing blood and require blood immediately. In some countries it is regarded"",""app"":""ecency/3.0.37-vision"",""format"":""markdown+html"",""image_ratios"":[""1.4011"",""1.0099""]}",2023-12-06 11:11:18,What Happens When You Donate Blood,/hive-196387/@thomisin/what-happens-when-you-donate,9
thomisin,how-your-nails-reflect-your,How Your Nails Reflect Your Health: Decoding Signs and Signals Associated With Our Fingernails,hive-196387,"<div class=""text-justify"">

Our nails are very important to us, in fact, all parts of our body are important and they can tell about our health. I have discussed how our eyes, hand, hair, and tongue tells us about our health, and so today I will be discussing the nails and how they can affect our health. You must have seen people who have white dots on their nails, yellow nails, ridges on nails, and even black line on nails but then yo do not understand what it could possibly be, so in this post I will be discussing our nails and our health.

https://media.snl.no/media/57636/standard_compressed_beau-01.jpg</div>
<sup>[sml](https://sml.snl.no/neglesykdommer)</sup>

Ever heard of the term 'Hollow Nail'? How about 'Koilonychia'? This term, derived from 'Koilos,' meaning hollow, and 'Onyx,' meaning nail, describes a condition where the nails take on a spoon-like shape capable of holding drops of liquid. People who have this type of nails usually suffer from Iron Deficiency Anemia which can lead to soft nails. Pe","{""image"":[""https://media.snl.no/media/57636/standard_compressed_beau-01.jpg"",""https://live.staticflickr.com/3873/15023020192_1882f49a7e_b.jpg"",""https://media.snl.no/media/262310/standard_compressed_halfhalf.jpeg""],""tags"":[""hive-196387"",""stemng"",""stemgeeks"",""health"",""fingernail"",""waivio"",""cent"",""ocdb"",""alive"",""proofofbrain""],""description"":""Our nails are very important to us, in fact, all parts of our body are important and they can tell about our health. I have discussed how our eyes, hand, hair, and tongue tells us about our health, and"",""app"":""ecency/3.0.37-vision"",""format"":""markdown+html"",""image_ratios"":[""1.3417"",""1.6009"",""1.3474""]}",2023-12-03 15:45:24,How Your Nails Reflect Your Health: Decoding Signs and Signals Associated With Our Fingernails,/hive-196387/@thomisin/how-your-nails-reflect-your,1
thomisin,hair-loss-and-its-relationship,Hair Loss and its Relationship With Your Health,hive-196387,"<div class=""text-justify"">

As a child, I usually thought that hair loss was associated with normal aging, but growing up, I got a different understanding, and I realized that hair loss has a lot to say when it comes to health than just aging. I have a neighbor who has been visiting the hospital because he has patches on his head and was diagnosed with Alopecia Areata. He has been receiving treatment and hopefully will get his hair back, I hope. So in this post, I will be discussing what hair loss could mean with your health.

Talking about Alopecia Areata; it is a condition where the immune system mistakenly attack the hair follicles. Yes, that's the condition that Will Smith's wife, Jada Smith is suffering from. It is not an uncommon thing, as 1 in 50 people will experience it at one point in time or the other happening at any age. When it comes to treatment, the patients are injected with Steroids directly into their scalp to calm the immune system but in severe cases, the treatment prednisone will be req","{""image"":[""https://upload.wikimedia.org/wikipedia/commons/6/6e/Haarausfall_Alopecia_Areata.jpg"",""https://commons.wikimedia.org/wiki/File:Haarausfall_Alopecia_Areata.jpg"",""https://live.staticflickr.com/7008/6410937117_f1566f9eaa_c.jpg"",""https://upload.wikimedia.org/wikipedia/commons/1/1a/Male_pattern_baldness.jpg"",""https://commons.wikimedia.org/wiki/File:Male_pattern_baldness.jpg""],""tags"":[""hive-196387"",""stemng"",""health"",""neoxian"",""ocdb"",""waivio"",""cent"",""proofofbrain"",""alive"",""stemgeeks""],""description"":""As a child, I usually thought that hair loss was associated with normal aging, but growing up, I got a different understanding, and I realized that hair loss has a lot to say when it comes to health than"",""app"":""ecency/3.0.37-vision"",""format"":""markdown+html"",""image_ratios"":[""1.9537"",0,""1.6701"",""1.1841"",0]}",2023-11-29 08:23:48,Hair Loss and its Relationship With Your Health,/hive-196387/@thomisin/hair-loss-and-its-relationship,1
thomisin,you-health-is-in-your,You Health is in Your Hand Because Your Hand Can Tell A lot About Your Health,hive-196387,"<div class=""text-justify"">

Ever wondered why doctors carefully examine your hands during a check-up? Much like your eyes and tongue, your hands can provide valuable clues about your health and potential underlying conditions. Let's delve into some telltale signs that your hands might reveal about your well-being.

Let me start with Arachnodactyly, and this can be confirmed in people whose thumb finger overlaps when holding a fist, or whose thumb and pinky finger overlap when holding the wrist. This is a sign that your fingers are long, and the name comes from its similarity with spider fingers. This type of finger is common with people with Marfan syndrome as they possess long fingers and arm span compared to their height. This is a genetic mutation and it can affect elastic fibers in other organs which can lead to pneumothorax causing the collapse of the lungs without any warning.

https://upload.wikimedia.org/wikipedia/commons/5/59/Steps_steinberg_sign.png</div>
<sup>[wikimedia](https://commons.wikimedia.","{""image"":[""https://upload.wikimedia.org/wikipedia/commons/5/59/Steps_steinberg_sign.png"",""https://commons.wikimedia.org/wiki/File:Steps_steinberg_sign.png"",""https://images.pexels.com/photos/4498211/pexels-photo-4498211.jpeg?auto=compress&cs=tinysrgb&w=1260&h=750&dpr=1""],""tags"":[""hive-196387"",""stemng"",""stemgeeks"",""proofofbrain"",""health"",""waivio"",""ocdb"",""cent"",""alive"",""neoxian""],""description"":""Ever wondered why doctors carefully examine your hands during a check-up? Much like your eyes and tongue, your hands can provide valuable clues about your health and potential underlying conditions. Let's"",""app"":""ecency/3.0.37-vision"",""format"":""markdown+html"",""image_ratios"":[""2.0764"",0,""1.5000""]}",2023-11-23 18:58:39,You Health is in Your Hand Because Your Hand Can Tell A lot About Your Health,/hive-196387/@thomisin/you-health-is-in-your,1
thomisin,the-tongue-a-gateway-to,"The Tongue, A Gateway to Your Health",hive-196387,"<div class=""text-justify"">

In my previous discourse, we delved into the multifaceted role of the tongue in shaping our health. Continuing on this fascinating journey, let's explore the intricate movements of the tongue and unravel the silent messages it conveys about our well-being. Before we delve into the health implications, let's assess the agility of our tongues.

The tongue can move in 5 ways, which includes rolling, cloverleaf, folding, and twisting left and right. While most people can role, cloverleaf is the most difficult while only about 5% of people can do the entire 5 tongue movement. Since you learned that already, let's discuss your tongue and what it says about your health.

https://live.staticflickr.com/5181/5640263119_fc328d8b7f_b.jpg</div>
<sup>[Flickr](https://www.flickr.com/photos/55293400@N07/5640263119)</sup>

Have you looked at a tongue and it looks just like strawberry? Then you must have heard of the name Strawberry tongue which is given to a tongue that is red and has prominent bu","{""image"":[""https://live.staticflickr.com/5181/5640263119_fc328d8b7f_b.jpg"",""https://upload.wikimedia.org/wikipedia/commons/5/5c/Geographic_tongue_01.JPG"",""https://commons.wikimedia.org/wiki/File:Geographic_tongue_01.JPG""],""tags"":[""hive-196387"",""stemng"",""health"",""neoxian"",""ocdb"",""waivio"",""proofofbrain"",""cent"",""bee"",""alive""],""description"":""In my previous discourse, we delved into the multifaceted role of the tongue in shaping our health. Continuing on this fascinating journey, let's explore the intricate movements of the tongue and unravel"",""app"":""ecency/3.0.37-vision"",""format"":""markdown+html"",""image_ratios"":[""1.4993"",""1.5311"",0]}",2023-11-19 15:20:30,"The Tongue, A Gateway to Your Health",/hive-196387/@thomisin/the-tongue-a-gateway-to,2
thomisin,the-tongue-as-a-window,The Tongue as A Window to Your Health,hive-196387,"<div class=""text-justify"">

In a previous discussion, we explored the eyes and the wealth of medical information they can reveal. Today, our focus shifts to another intriguing part of the body; the tongue. The tongue, often cited erroneously as the strongest muscle, doesn't hold that title, yet its condition can offer valuable insights into one's health.

A quick one, if someone tells you that the tongue is the strongest muscle, they they you fed you lies because it isn't. Actually, the masseter which is a jaw muscle is the strongest based on weight but while it is not the strongest, it hold strong inference when it comes to your health.

<center>https://upload.wikimedia.org/wikipedia/commons/d/d4/Median_Glossitis_%28edit%29.jpg</div>
[wikimedia.org](https://commons.wikimedia.org/wiki/File:Median_Glossitis_%28edit%29.jpg)</center>

The normal healthy tongue has the color pink and it possesses little bumps on them known as the pilli but then some people have their tongue pink and smooth in a condition known a","{""image"":[""https://upload.wikimedia.org/wikipedia/commons/d/d4/Median_Glossitis_%28edit%29.jpg"",""https://commons.wikimedia.org/wiki/File:Median_Glossitis_%28edit%29.jpg"",""https://live.staticflickr.com/2917/14768027882_911cef68c6_b.jpg"",""https://cdn2.picryl.com/photo/2016/12/31/oral-thrush-aphthae-candida-albicans-phil-1217-lores-9667d8-1024.jpg""],""tags"":[""hive-196387"",""stemng"",""tongue"",""neoxian"",""ocdb"",""stemgeeks"",""proofofbrain"",""cent"",""waivio"",""alive""],""description"":""In a previous discussion, we explored the eyes and the wealth of medical information they can reveal. Today, our focus shifts to another intriguing part of the body; the tongue. The tongue, often cited"",""app"":""ecency/3.0.37-vision"",""format"":""markdown+html"",""image_ratios"":[""0.8603"",0,""0.7773"",""1.4819""]}",2023-11-10 22:40:42,The Tongue as A Window to Your Health,/hive-196387/@thomisin/the-tongue-as-a-window,2
thomisin,antibiotics-the-double-edged-sword,Antibiotics: The Double-Edged Sword,hive-196387,"<div class=""text-justify"">

One of the most commonly used class of medications in our world is antibiotics as they have been effective tool to save lives and treat diseases but then they also have negative results which can be very dangerous. So in this post, i will be discussing antibiotics with you in full.

In other to get why this group of drug do both good and harm, we need to understand its meaning. Antibiotics are generally substances that kills or inhibits the growth of bacteria but while they do this, the exhibit a property know has selective toxicity where the drug has the ability to harm or kill microorganisms without causing any harm or damage to the host's cell. This is possible by allowing the drug to target the structures of the microorganism's cells through their mechanisms which is different from ours like for instance, bacteria have cell walls but our cells don't have cell walls, we also have different materials in our nucleic acids, ribosome, and cell membrane.\

https://live.staticflickr.","{""image"":[""https://live.staticflickr.com/4567/38392167481_e0c91e2441_b.jpg"",""https://upload.wikimedia.org/wikipedia/commons/8/87/Antibiotics_action.png"",""https://commons.wikimedia.org/wiki/File:Antibiotics_action.png""],""tags"":[""hive-196387"",""stemng"",""stemgeeks"",""neoxian"",""waivio"",""cent"",""alive"",""antibiotics"",""ocdb"",""science""],""description"":""One of the most commonly used class of medications in our world is antibiotics as they have been effective tool to save lives and treat diseases but then they also have negative results which can be very"",""app"":""ecency/3.0.36-vision"",""format"":""markdown+html"",""image_ratios"":[""1.3333"",""1.0765"",0]}",2023-11-06 08:27:36,Antibiotics: The Double-Edged Sword,/hive-196387/@thomisin/antibiotics-the-double-edged-sword,3
thomisin,marijuana-and-sleep-the-complex,Marijuana and Sleep: The Complex Relationship Between Cannabis and Slumber,hive-196387,"<div class=""text-justify"">

The terminology surrounding cannabis, whether it's called marijuana, weed, or cannabis, is as diverse as its uses. In recent times, it has become increasingly prevalent in various forms, from edibles to smokable products. While many people use cannabis for recreational purposes, one crucial aspect that warrants discussion is its impact on sleep.

Some people have claimed that they use cannabis to make them sleep, while others say that it makes their sleeping worse. So in this post, I will be looking at what happens to the body when we go to bed after taking cannabis and feeling high, are we hurting our  sleep, affecting our energy level, and disturbing our mental capacity?

https://cdn12.picryl.com/photo/2016/12/31/cannabis-sativa-marijuana-cannabis-health-medical-8ab8fd-1024.jpg</div>
<sup>[picryl](https://jenikirbyhistory.getarchive.net/media/cannabis-sativa-marijuana-cannabis-health-medical-8ab8fd)</sup></div>

To start, we can't dismiss the fact that THC, a key compound in can","{""image"":[""https://cdn12.picryl.com/photo/2016/12/31/cannabis-sativa-marijuana-cannabis-health-medical-8ab8fd-1024.jpg"",""https://live.staticflickr.com/144/391999554_4b7abce822_b.jpg""],""tags"":[""hive-196387"",""stemng"",""cannabis"",""neoxian"",""proofofbrain"",""stemgeeks"",""waivio"",""cent"",""alive"",""bee""],""description"":""The terminology surrounding cannabis, whether it's called marijuana, weed, or cannabis, is as diverse as its uses. In recent times, it has become increasingly prevalent in various forms, from edibles to"",""app"":""ecency/3.0.36-vision"",""format"":""markdown+html"",""image_ratios"":[0,0]}",2023-11-03 07:20:09,Marijuana and Sleep: The Complex Relationship Between Cannabis and Slumber,/hive-196387/@thomisin/marijuana-and-sleep-the-complex,4
thomisin,the-hidden-health-clues-your,The Hidden Health Clues Your Eyes Reveal About Your Overall Well-Being.,hive-196387,"<div class=""text-justify"">

In my previous post, we delved into the fascinating world of eye health, exploring how various eye conditions and changes can provide valuable insights into our overall well-being. We discussed the Kayser-Fleicher ring, a golden brown ring around the iris associated with copper buildup in conditions like Wilson disease. Today, we continue our journey through the eyes, focusing on another type of ring that can appear in the iris, as well as other eye indicators of our health.

A Corneal Arcus occurs when cholesterol deposits in the eye, and this what causes the white or gray ring around the iris. It isn't like the ring damages the eye as it is common with people who are aged but when in young people, it could be as a result of conditions such as Familial hypercholesterolemia where cholesterol is deposited in different parts of the body including the eyelids, and tendons.

https://live.staticflickr.com/7111/7602347852_89983ae86e_b.jpg</div>
<sup>[Flickr](https://www.flickr.com/photo","{""image"":[""https://live.staticflickr.com/7111/7602347852_89983ae86e_b.jpg"",""https://live.staticflickr.com/322/32271351330_602dac00f2_b.jpg"",""https://live.staticflickr.com/4101/5444947567_6cd78726a3_b.jpg""],""tags"":[""hive-196387"",""stemng"",""neoxian"",""ocdb"",""neoxag"",""proofofbrain"",""stemgeeks"",""waivio"",""cent"",""alive""],""description"":""In my previous post, we delved into the fascinating world of eye health, exploring how various eye conditions and changes can provide valuable insights into our overall well-being. We discussed the"",""app"":""ecency/3.0.36-vision"",""format"":""markdown+html"",""image_ratios"":[""1.5610"",""1.5876"",""1.5352""]}",2023-10-31 10:23:09,The Hidden Health Clues Your Eyes Reveal About Your Overall Well-Being.,/hive-196387/@thomisin/the-hidden-health-clues-your,1
thomisin,the-eyes-as-health-mirrors,The Eyes as Health Mirrors: What Your Eye Color and Sclera Reveal About Your Well-Being,hive-196387,"<div class=""text-justify"">

You hear words like the heart is the window to your soul, or the gateway to an opened mind. Well, I do not know about that, but on thing I am certain about one thing, the eye can tell a lot about how you are doing and how healthy you are.

First and foremost, the white part of your eye, known as the sclera, should ideally remain white, indicating good health. However, when the entire sclera turns yellow, it's a sign of a condition called Scleral Icterus that should not be overlooked. This yellowing suggests an elevated level of bilirubin in the body. Normally, red blood cells have a lifespan of about 120 days or 4 months, after which they break down to produce bilirubin, which the liver processes.

https://cdn2.picryl.com/photo/1963/12/31/jaundice-eye-c29c46-640.jpg</div>
<sup>[picryl](https://picryl.com/media/jaundice-eye-c29c46)</sup>

Yellowing of the sclera can be attributed to either an accelerated breakdown of red blood cells or a malfunction in the liver's bilirubin process","{""image"":[""https://cdn2.picryl.com/photo/1963/12/31/jaundice-eye-c29c46-640.jpg"",""https://www.publicdomainpictures.net/pictures/10000/nahled/eye-331280344063eHu3.jpg""],""tags"":[""hive-196387""],""description"":""You hear words like the heart is the window to your soul, or the gateway to an opened mind. Well, I do not know about that, but on thing I am certain about one thing, the eye can tell a lot about how you"",""app"":""ecency/3.0.36-vision"",""format"":""markdown+html"",""image_ratios"":[""1.3974"",""1.5000""]}",2023-10-27 19:22:06,The Eyes as Health Mirrors: What Your Eye Color and Sclera Reveal About Your Well-Being,/hive-196387/@thomisin/the-eyes-as-health-mirrors,4
